[
  {
    "id": "armor_rags",
    "name": "Łachmany Rozbitka",
    "description": "Podarte, mokre od morskiej wody. Chronią tylko wstyd.",
    "category": "armor",
    "value": 0,
    "weight": 0.5,
    "icon": "armor_rags",
    "asset_path": "sprites/items/armor_rags.png",
    "armor": 1,
    "magic_resist": 0,
    "slot": "chest"
  },
  {
    "id": "armor_leather_vest",
    "name": "Skórzany Kamizel",
    "description": "Garbowana skóra, trochę wzmocniona metalowymi nitami. Pospolite, ale skuteczne.",
    "category": "armor",
    "value": 50,
    "weight": 2.0,
    "icon": "armor_leather_vest",
    "asset_path": "sprites/items/armor_leather_vest.png",
    "armor": 5,
    "magic_resist": 1,
    "slot": "chest"
  },
  {
    "id": "armor_guard_chainmail",
    "name": "Kolczuga Straży",
    "description": "Standardowy pancerz Grodu Straży. Żelazne kółka, skórzane wzmocnienia, dumny emblemat.",
    "category": "armor",
    "value": 250,
    "weight": 6.0,
    "icon": "armor_guard_chainmail",
    "asset_path": "sprites/items/armor_guard_chainmail.png",
    "armor": 12,
    "magic_resist": 3,
    "faction": "old_order",
    "slot": "chest",
    "requirements": { "strength": 12 }
  },
  {
    "id": "armor_free_hide",
    "name": "Skóra Wolnych",
    "description": "Ciężki pancerz z dziczyzny, wzmacniany kośćmi i twardą skórą. Znak Wolnych Chat.",
    "category": "armor",
    "value": 300,
    "weight": 5.0,
    "icon": "armor_free_hide",
    "asset_path": "sprites/items/armor_free_hide.png",
    "armor": 14,
    "magic_resist": 4,
    "faction": "new_order",
    "slot": "chest",
    "requirements": { "strength": 14 }
  },
  {
    "id": "armor_iron_plate",
    "name": "Żelazny Płytowy",
    "description": "Pełna płyta z żelaza. Ciężka, nieporęczna, ale nie do przebicia.",
    "category": "armor",
    "value": 600,
    "weight": 12.0,
    "icon": "armor_iron_plate",
    "asset_path": "sprites/items/armor_iron_plate.png",
    "armor": 22,
    "magic_resist": 5,
    "slot": "chest",
    "requirements": { "strength": 24 }
  },
  {
    "id": "armor_shadow_leather",
    "name": "Ciemna Skóra",
    "description": "Czarna, elastyczna zbroja ze skóry nieznanego stworzenia. Nie krępuje ruchów.",
    "category": "armor",
    "value": 450,
    "weight": 2.5,
    "icon": "armor_shadow_leather",
    "asset_path": "sprites/items/armor_shadow_leather.png",
    "armor": 16,
    "magic_resist": 8,
    "slot": "chest",
    "requirements": { "dexterity": 18 }
  }
]
